### ISSUE TITLE
Unable to add TP07 Fan

### ISSUE THREAD

**Issue by ryan-roche** [libdyson-wg/ha-dyson#289]
Hello,

I just got my TP07 and am attempting to add it to HomeAssistant using this plugin. My model doesn't include the Wi-Fi information sticker, so I've attempted to add it both with the MyDyson account method and the "manual" option using the `opendyson` CLI tool, but both methods result in the same "Failed to connect. The IP Address may be required if your Home Assistant installation is running in a Container or a VM." error, which is weird because I am specifying the IP address that both my Unifi Network and `opendyson` report the purifier having.

What's really confusing me is that when I go to the integration's page under Settings > Devices & Integrations, it suggests the purifier as "Discovered" with a big green Add button, but it still doesn't work. I have on idea how it's managing to get as far as discovering the purifier but failing to actually add it. I've tried power cycling it, both with the remote and by unplugging it from the wall, but still no dice.

**Comment by mmcramos** [comment]
i am also having the same issue since upgrading to this latest version.  it used to work on the dyson-local and dyson cloud integration. also  i tried specifying the ip address but it still failed to connect.  traffic can be seen using tcpdump.

21:28:50.918265 IP 192.168.86.39.1883 > home-server.49281: Flags [S.], seq 19083345, ack 2672147694, win 4096, options [mss 1452], length 0
21:28:50.918623 IP home-server.49281 > 192.168.86.39.1883: Flags [.], ack 1, win 64240, length 0
21:28:50.919059 IP home-server.49281 > 192.168.86.39.1883: Flags [P.], seq 1:147, ack 1, win 64240, length 146
21:28:50.924423 IP 192.168.86.39.1883 > home-server.49281: Flags [.], ack 147, win 3950, length 0
21:28:51.286366 IP 192.168.86.39.1883 > home-server.49281: Flags [P.], seq 1:5, ack 147, win 4096, length 4
21:28:51.286862 IP home-server.49281 > 192.168.86.39.1883: Flags [.], ack 5, win 64236, length 0
21:28:51.288213 IP home-server.49281 > 192.168.86.39.1883: Flags [P.], seq 147:188, ack 5, win 64236, length 41
21:28:51.289051 IP 192.168.86.39.1883 > home-server.49281: Flags [.], ack 188, win 4096, length 0

**Comment by mmcramos** [comment]
Hi, just to update. I managed to make it work by using the old version 1.5.7

**Comment by kevzz01** [comment]
> Hi, just to update. I managed to make it work by using the old version 1.5.7

You’re a lifesaver. Thank you!

**Comment by ryan-roche** [comment]
> > Hi, just to update. I managed to make it work by using the old version 1.5.7
> 
> You’re a lifesaver. Thank you!

Good to know for the meantime while we wait for a fix!

For plugin devs- I was able to get it connected with no issue on the latest version of the HomeBridge plugin, so maybe look into what they're doing to link to the Dyson API?

I haven't done any HomeAssistant development before, but if I've got some free time I might look into implementing the fix myself if I can figure it out

**Comment by GelmirTelrunya** [comment]
I had the same problem, thanks for suggesting using an older version.
Version 1.6.0 also works for me.
